{"acceptance":{"maximum_authority_bypass_count":0,"maximum_collateral_denial_count":0,"maximum_incorrect_reason_count":0,"maximum_invalid_allow_count":0,"require_complete_outcomes":true},"agents":[{"agent_id":"agent-a","allowed_policy_ids":["high-impact","standard-change"],"workload_spiffe_id":"spiffe://example.gov/workload/agent-a"}],"campaign_id":"luremandate-sequence-v1","created_at":"2026-09-05T14:59:00Z","environment":{"environment_id":"federal-research-sandbox","tenant_id":"agency-tenant"},"limitations":["synthetic_metadata_only_no_prompts_commands_payloads_credentials_hosts_urls_or_customer_content","approval_identity_role_timestamp_and_effect_records_are_claims_not_authenticated_facts","impact_units_are_organization_defined_ordinals_not_currency_or_a_safety_measure","results_cover_only_submitted_transactions_and_do_not_establish_complete_runtime_mediation","passing_is_not_compliance_certification_legal_authority_or_deployment_authorization"],"people":[{"person_id":"approver-mission","roles":["mission-owner"]},{"person_id":"approver-operator","roles":["operator"]},{"person_id":"approver-security","roles":["security-reviewer"]},{"person_id":"requester-a","roles":["requester"]},{"person_id":"sequence-subject-01","roles":["requester"]},{"person_id":"sequence-subject-02","roles":["requester"]},{"person_id":"sequence-subject-03","roles":["requester"]},{"person_id":"sequence-subject-04","roles":["requester"]},{"person_id":"sequence-subject-05","roles":["requester"]},{"person_id":"sequence-subject-06","roles":["requester"]},{"person_id":"sequence-subject-07","roles":["requester"]},{"person_id":"sequence-subject-08","roles":["requester"]},{"person_id":"sequence-subject-09","roles":["requester"]},{"person_id":"sequence-subject-10","roles":["requester"]},{"person_id":"sequence-subject-11","roles":["requester"]},{"person_id":"sequence-subject-12","roles":["requester"]},{"person_id":"sequence-subject-13","roles":["requester"]},{"person_id":"sequence-subject-14","roles":["requester"]},{"person_id":"sequence-subject-15","roles":["requester"]},{"person_id":"sequence-subject-16","roles":["requester"]},{"person_id":"sequence-subject-17","roles":["requester"]},{"person_id":"sequence-subject-18","roles":["requester"]},{"person_id":"sequence-subject-19","roles":["requester"]},{"person_id":"sequence-subject-20","roles":["requester"]},{"person_id":"sequence-subject-21","roles":["requester"]},{"person_id":"sequence-subject-22","roles":["requester"]},{"person_id":"sequence-subject-23","roles":["requester"]},{"person_id":"sequence-subject-24","roles":["requester"]},{"person_id":"sequence-subject-25","roles":["requester"]},{"person_id":"sequence-subject-26","roles":["requester"]}],"policies":[{"approval_ttl_ms":120000,"cumulative_limit_units":150,"cumulative_scope":"requester_policy","cumulative_window_ms":3600000,"maximum_impact_units":100,"minimum_distinct_approvers":2,"policy_id":"high-impact","prohibit_self_approval":true,"required_approver_roles":["mission-owner","security-reviewer"],"single_use_approvals":true,"transaction_class":"high-impact-change"},{"approval_ttl_ms":300000,"cumulative_limit_units":50,"cumulative_scope":"requester_policy","cumulative_window_ms":3600000,"maximum_impact_units":25,"minimum_distinct_approvers":1,"policy_id":"standard-change","prohibit_self_approval":true,"required_approver_roles":["operator"],"single_use_approvals":true,"transaction_class":"standard-change"}],"privacy":{"customer_content":"excluded","personal_data":"synthetic_identifiers_only","secrets":"excluded","transaction_payloads":"excluded_digest_bound_metadata_only"},"schema":"https://github.com/immu4989/lurebench/spec/luremandate-plan-v1","schema_version":1}
